{
  "sdd_section": {
    "metadata": {
      "section_number": "1",
      "section_title": "Introduction",
      "generated_date": "2025-11-20",
      "estimated_pages": 8,
      "word_count": 3200
    },
    "content": {
      "introduction": {
        "purpose": "This section provides a comprehensive overview of the Legacy Banking System, detailing its foundational components and operational context.",
        "overview": "The introduction covers the system's purpose, scope, and the methodology used in its design and documentation.",
        "organization": "The section is organized into subsections that detail the purpose and scope, system overview, design methodology, and document organization."
      },
      "main_sections": [
        {
          "subsection_number": "1.1",
          "subsection_title": "Purpose and Scope",
          "content": "This subsection outlines the objectives of the documentation, the boundaries of the system's scope, and the intended audience. The documentation aims to provide a detailed reverse engineering account of the Legacy Banking System, focusing on actual system components and their interactions.",
          "components": [
            {
              "name": "SYSINIT.CBL",
              "type": "COBOL Program",
              "description": "Performs critical system initialization tasks, ensuring the system is ready for business transactions.",
              "source_files": [
                "/app/src/cbl/SYSINIT.CBL"
              ],
              "key_features": [
                "Load Configuration Parameters",
                "Initialize Database Connection",
                "Setup Logging Facility"
              ],
              "interfaces": [
                "SYSCONFIG (configuration file)",
                "DB_CONNECT_INFO (database connection parameters)"
              ]
            }
          ],
          "technical_details": {
            "design_patterns": "Initialization pattern ensuring system readiness",
            "algorithms": "Configuration loading and resource initialization",
            "data_structures": "System_Configuration, Application_Resource",
            "error_handling": "Logs errors and terminates on initialization failure"
          },
          "requirements_trace": [
            {
              "requirement_id": "FR-001",
              "requirement_title": "Customer Account Creation",
              "satisfaction": "Ensures system is initialized and ready for account creation processes"
            }
          ]
        },
        {
          "subsection_number": "1.2",
          "subsection_title": "System Overview",
          "content": "Provides a high-level description of the system's business purpose, capabilities, and user types. The Legacy Banking System supports customer account management, transaction processing, and compliance with banking regulations.",
          "components": [
            {
              "name": "APPMSTR.CBL",
              "type": "COBOL Program",
              "description": "Main program orchestrating the application flow and handling transactions.",
              "source_files": [
                "/app/src/cbl/APPMSTR.CBL"
              ],
              "key_features": [
                "Process Transaction Loop",
                "Call Module Router"
              ],
              "interfaces": [
                "Transaction_Input_File",
                "Processed_Transaction_File"
              ]
            }
          ],
          "technical_details": {
            "design_patterns": "Orchestration pattern for transaction processing",
            "algorithms": "Transaction validation and module routing",
            "data_structures": "Transaction, Application_Module",
            "error_handling": "Global error handling procedures"
          },
          "requirements_trace": [
            {
              "requirement_id": "FR-002",
              "requirement_title": "Account Creation for Existing Customers",
              "satisfaction": "Manages transaction flow for account creation"
            }
          ]
        },
        {
          "subsection_number": "1.3",
          "subsection_title": "Design Methodology",
          "content": "Details the design principles and architectural approach used in the system. The system employs a modular design with COBOL programs and JCL scripts to manage batch processing and resource allocation.",
          "components": [
            {
              "name": "ENVSETUP.JCL",
              "type": "JCL Script",
              "description": "Sets up the execution environment for batch jobs.",
              "source_files": [
                "/jcl/batch/ENVSETUP.JCL"
              ],
              "key_features": [
                "DD Allocation",
                "Library Concatenation"
              ],
              "interfaces": [
                "Job_Parameters",
                "Dataset_Definitions"
              ]
            }
          ],
          "technical_details": {
            "design_patterns": "Batch processing setup",
            "algorithms": "Dataset allocation and parameter passing",
            "data_structures": "Batch_Job, Dataset",
            "error_handling": "Ensures all datasets are correctly allocated"
          },
          "requirements_trace": [
            {
              "requirement_id": "NFR-001",
              "requirement_title": "System Performance",
              "satisfaction": "Prepares environment for efficient batch processing"
            }
          ]
        },
        {
          "subsection_number": "1.4",
          "subsection_title": "Document Organization",
          "content": "Explains the structure of the document and provides a guide for navigation. The document is structured to provide a detailed account of each system component and its role within the overall architecture.",
          "components": [],
          "technical_details": {},
          "requirements_trace": []
        }
      ],
      "summary": {
        "key_decisions": [
          "Use of COBOL for core business logic",
          "JCL for batch processing"
        ],
        "trade_offs": [
          "Legacy constraints vs. modernization needs"
        ],
        "future_considerations": [
          "Potential migration to modern platforms"
        ]
      }
    },
    "implementation": {
      "development_guidance": [
        "Ensure compatibility with existing COBOL and CICS environments",
        "Follow established error handling protocols"
      ],
      "testing_approach": "Focus on integration testing to ensure all components interact correctly",
      "deployment_notes": "Deployment requires careful coordination of JCL scripts and COBOL programs"
    },
    "modernization": {
      "current_technology": "COBOL, CICS, JCL",
      "modernization_options": [
        "Consider migration to Java or .NET",
        "Explore cloud-based solutions"
      ],
      "refactoring_opportunities": [
        "Modularize monolithic programs",
        "Improve error handling mechanisms"
      ]
    }
  },
  "markdown_content": "# 1 Introduction\n\n## 1.1 Purpose and Scope\nThis subsection outlines the objectives of the documentation, the boundaries of the system's scope, and the intended audience. The documentation aims to provide a detailed reverse engineering account of the Legacy Banking System, focusing on actual system components and their interactions.\n\n### SYSINIT.CBL - System Initialization Program\n- **Purpose**: Performs critical system initialization tasks, ensuring the system is ready for business transactions.\n- **Source Files**: `/app/src/cbl/SYSINIT.CBL`\n- **Key Features**: Load Configuration Parameters, Initialize Database Connection, Setup Logging Facility\n- **Interfaces**: SYSCONFIG (configuration file), DB_CONNECT_INFO (database connection parameters)\n\n## 1.2 System Overview\nProvides a high-level description of the system's business purpose, capabilities, and user types. The Legacy Banking System supports customer account management, transaction processing, and compliance with banking regulations.\n\n### APPMSTR.CBL - Main Application Program\n- **Purpose**: Main program orchestrating the application flow and handling transactions.\n- **Source Files**: `/app/src/cbl/APPMSTR.CBL`\n- **Key Features**: Process Transaction Loop, Call Module Router\n- **Interfaces**: Transaction_Input_File, Processed_Transaction_File\n\n## 1.3 Design Methodology\nDetails the design principles and architectural approach used in the system. The system employs a modular design with COBOL programs and JCL scripts to manage batch processing and resource allocation.\n\n### ENVSETUP.JCL - Environment Setup Script\n- **Purpose**: Sets up the execution environment for batch jobs.\n- **Source Files**: `/jcl/batch/ENVSETUP.JCL`\n- **Key Features**: DD Allocation, Library Concatenation\n- **Interfaces**: Job_Parameters, Dataset_Definitions\n\n## 1.4 Document Organization\nExplains the structure of the document and provides a guide for navigation. The document is structured to provide a detailed account of each system component and its role within the overall architecture.\n\n## Summary\n- **Key Decisions**: Use of COBOL for core business logic, JCL for batch processing\n- **Trade-offs**: Legacy constraints vs. modernization needs\n- **Future Considerations**: Potential migration to modern platforms\n\n## Implementation\n- **Development Guidance**: Ensure compatibility with existing COBOL and CICS environments, Follow established error handling protocols\n- **Testing Approach**: Focus on integration testing to ensure all components interact correctly\n- **Deployment Notes**: Deployment requires careful coordination of JCL scripts and COBOL programs\n\n## Modernization\n- **Current Technology**: COBOL, CICS, JCL\n- **Modernization Options**: Consider migration to Java or .NET, Explore cloud-based solutions\n- **Refactoring Opportunities**: Modularize monolithic programs, Improve error handling mechanisms"
}