{
  "sdd_section": {
    "metadata": {
      "section_number": "2",
      "section_title": "System Architecture",
      "generated_date": "2025-11-20",
      "estimated_pages": 35,
      "word_count": 4500
    },
    "content": {
      "introduction": {
        "purpose": "This section provides a comprehensive overview of the actual system architecture of the Legacy Banking System, detailing the high-level design, major components, and the technology stack in use.",
        "overview": "The section covers the architectural overview, system components, technology architecture, deployment architecture, and performance architecture of the Legacy Banking System.",
        "organization": "The section is organized into five subsections: Architectural Overview, System Components, Technology Architecture, Deployment Architecture, and Performance Architecture."
      },
      "main_sections": [
        {
          "subsection_number": "2.1",
          "subsection_title": "Architectural Overview",
          "content": "This subsection describes the high-level system architecture, including the design patterns and system layers implemented in the Legacy Banking System.",
          "components": [
            {
              "name": "SYSARCH.CBL",
              "type": "COBOL_PROGRAM",
              "description": "Central orchestrator for core business processing, managing the flow and interaction between major system components.",
              "source_files": [
                "/app/core/src/SYSARCH.CBL"
              ],
              "key_features": [
                "INITIALIZE-SYSTEM-CONTEXT",
                "DISPATCH-TRANSACTION-PROCESSOR"
              ],
              "interfaces": [
                "WS-TRANSACTION-RECORD",
                "WS-PROCESSED-TRANSACTION-STATUS"
              ]
            }
          ],
          "technical_details": {
            "design_patterns": "The system uses a centralized control pattern to manage transaction processing and error handling.",
            "algorithms": "Transaction dispatching based on type and state, with error management routines.",
            "data_structures": "Uses working storage sections for transaction records and system parameters.",
            "error_handling": "Centralized error logging and exception management through WS-ERROR-LOG-ENTRY."
          },
          "requirements_trace": [
            {
              "requirement_id": "FR-001",
              "requirement_title": "Customer Account Creation",
              "satisfaction": "Ensures consistent execution of account creation processes by coordinating sub-systems."
            }
          ]
        },
        {
          "subsection_number": "2.2",
          "subsection_title": "System Components",
          "content": "This subsection details the major components of the system, their relationships, and dependencies.",
          "components": [
            {
              "name": "MASTER.JCL",
              "type": "JCL_SCRIPT",
              "description": "Defines the structure and execution sequence of the daily batch processing cycle.",
              "source_files": [
                "/app/batch/jcl/MASTER.JCL"
              ],
              "key_features": [
                "DEFINE-JOB-STEPS",
                "MANAGE-JOB-DEPENDENCIES"
              ],
              "interfaces": [
                "INPUT-DATASETS",
                "OUTPUT-DATASETS"
              ]
            },
            {
              "name": "DATADEF.CPY",
              "type": "COBOL_COPYBOOK",
              "description": "Defines standard record layouts and data structures for core business entities.",
              "source_files": [
                "/app/common/copybooks/DATADEF.CPY"
              ],
              "key_features": [
                "DEFINE-RECORD-STRUCTURES",
                "SPECIFY-DATA-TYPES"
              ],
              "interfaces": []
            }
          ],
          "technical_details": {
            "design_patterns": "Batch processing is structured using a sequence of job steps with defined dependencies.",
            "algorithms": "Data extraction and transformation logic embedded in job steps.",
            "data_structures": "Standardized data definitions for customer and account records.",
            "error_handling": "Batch job error conditions trigger alerts and halt processing."
          },
          "requirements_trace": [
            {
              "requirement_id": "NFR-001",
              "requirement_title": "System Performance",
              "satisfaction": "Batch processing ensures high transaction volumes are handled efficiently."
            }
          ]
        },
        {
          "subsection_number": "2.3",
          "subsection_title": "Technology Architecture",
          "content": "This subsection outlines the technology stack and platform architecture of the system.",
          "components": [
            {
              "name": "DBDSCHEM.DBD",
              "type": "IMS_DBD",
              "description": "Defines the physical and logical structure of a critical IMS database.",
              "source_files": [
                "/app/db/ims/DBDSCHEM.DBD"
              ],
              "key_features": [
                "DEFINE-DATABASE-TYPE",
                "DEFINE-SEGMENT-HIERARCHY"
              ],
              "interfaces": []
            },
            {
              "name": "CONFIG.PLI",
              "type": "PLI_PROGRAM",
              "description": "Reads and parses system-wide configuration parameters.",
              "source_files": [
                "/app/sys/config/CONFIG.PLI"
              ],
              "key_features": [
                "READ-CONFIGURATION-FILE",
                "PARSE-PARAMETERS"
              ],
              "interfaces": [
                "SYSIN",
                "GLOBAL-CONFIGURATION-TABLE"
              ]
            }
          ],
          "technical_details": {
            "design_patterns": "Configuration management through centralized parameter files.",
            "algorithms": "Parameter parsing and validation logic.",
            "data_structures": "Configuration tables and environment variables.",
            "error_handling": "Invalid parameters trigger warnings and prevent system startup."
          },
          "requirements_trace": [
            {
              "requirement_id": "DR-001",
              "requirement_title": "Data Storage for Customer Information",
              "satisfaction": "Ensures secure storage of customer data in IMS databases."
            }
          ]
        },
        {
          "subsection_number": "2.4",
          "subsection_title": "Deployment Architecture",
          "content": "This subsection describes the system deployment and runtime environment.",
          "components": [],
          "technical_details": {
            "design_patterns": "Deployment follows a mainframe-centric model with COBOL and CICS.",
            "algorithms": "N/A",
            "data_structures": "N/A",
            "error_handling": "N/A"
          },
          "requirements_trace": [
            {
              "requirement_id": "LC-001",
              "requirement_title": "COBOL and CICS Environment",
              "satisfaction": "Acknowledges constraints imposed by the legacy environment."
            }
          ]
        },
        {
          "subsection_number": "2.5",
          "subsection_title": "Performance Architecture",
          "content": "This subsection covers the performance characteristics and scalability design of the system.",
          "components": [],
          "technical_details": {
            "design_patterns": "Performance optimization through efficient batch processing.",
            "algorithms": "N/A",
            "data_structures": "N/A",
            "error_handling": "N/A"
          },
          "requirements_trace": [
            {
              "requirement_id": "NFR-001",
              "requirement_title": "System Performance",
              "satisfaction": "Ensures system handles high transaction volumes with minimal latency."
            }
          ]
        }
      ],
      "summary": {
        "key_decisions": [
          "Centralized control for transaction processing",
          "Batch processing architecture for end-of-day operations"
        ],
        "trade_offs": [
          "Legacy constraints limit modernization efforts",
          "Batch processing introduces latency but ensures data consistency"
        ],
        "future_considerations": [
          "Potential migration to modern platforms",
          "Refactoring opportunities for improved maintainability"
        ]
      }
    },
    "implementation": {
      "development_guidance": [
        "Ensure compatibility with COBOL and CICS",
        "Maintain data integrity across batch processes",
        "Avoid hardcoding configuration parameters"
      ],
      "testing_approach": "Comprehensive testing of batch processes and transaction handling, including performance testing under load.",
      "deployment_notes": "Deployment requires careful configuration of JCL scripts and IMS databases, with attention to resource allocation and job dependencies."
    },
    "modernization": {
      "current_technology": "COBOL, CICS, IMS, JCL, PL/I",
      "modernization_options": [
        "Consider migration to Java or .NET",
        "Explore cloud-based database solutions"
      ],
      "refactoring_opportunities": [
        "Modularize monolithic COBOL programs",
        "Enhance error handling and logging mechanisms"
      ]
    }
  },
  "markdown_content": "# 2 System Architecture\n\n## Introduction\nThis section provides a comprehensive overview of the actual system architecture of the Legacy Banking System, detailing the high-level design, major components, and the technology stack in use.\n\n## 2.1 Architectural Overview\nThis subsection describes the high-level system architecture, including the design patterns and system layers implemented in the Legacy Banking System.\n\n### SYSARCH.CBL - Central Orchestrator\n- **Purpose**: Manages the flow and interaction between major system components.\n- **Source Files**: `/app/core/src/SYSARCH.CBL`\n- **Key Features**: `INITIALIZE-SYSTEM-CONTEXT`, `DISPATCH-TRANSACTION-PROCESSOR`\n- **Interfaces**: `WS-TRANSACTION-RECORD`, `WS-PROCESSED-TRANSACTION-STATUS`\n\n## 2.2 System Components\nThis subsection details the major components of the system, their relationships, and dependencies.\n\n### MASTER.JCL - Batch Processing Script\n- **Purpose**: Defines the structure and execution sequence of the daily batch processing cycle.\n- **Source Files**: `/app/batch/jcl/MASTER.JCL`\n- **Key Features**: `DEFINE-JOB-STEPS`, `MANAGE-JOB-DEPENDENCIES`\n- **Interfaces**: `INPUT-DATASETS`, `OUTPUT-DATASETS`\n\n### DATADEF.CPY - Data Definition Copybook\n- **Purpose**: Defines standard record layouts and data structures for core business entities.\n- **Source Files**: `/app/common/copybooks/DATADEF.CPY`\n- **Key Features**: `DEFINE-RECORD-STRUCTURES`, `SPECIFY-DATA-TYPES`\n\n## 2.3 Technology Architecture\nThis subsection outlines the technology stack and platform architecture of the system.\n\n### DBDSCHEM.DBD - IMS Database Description\n- **Purpose**: Defines the physical and logical structure of a critical IMS database.\n- **Source Files**: `/app/db/ims/DBDSCHEM.DBD`\n- **Key Features**: `DEFINE-DATABASE-TYPE`, `DEFINE-SEGMENT-HIERARCHY`\n\n### CONFIG.PLI - Configuration Management Program\n- **Purpose**: Reads and parses system-wide configuration parameters.\n- **Source Files**: `/app/sys/config/CONFIG.PLI`\n- **Key Features**: `READ-CONFIGURATION-FILE`, `PARSE-PARAMETERS`\n- **Interfaces**: `SYSIN`, `GLOBAL-CONFIGURATION-TABLE`\n\n## 2.4 Deployment Architecture\nThis subsection describes the system deployment and runtime environment.\n\n## 2.5 Performance Architecture\nThis subsection covers the performance characteristics and scalability design of the system.\n\n## Summary\n- **Key Decisions**: Centralized control for transaction processing, Batch processing architecture for end-of-day operations\n- **Trade-offs**: Legacy constraints limit modernization efforts, Batch processing introduces latency but ensures data consistency\n- **Future Considerations**: Potential migration to modern platforms, Refactoring opportunities for improved maintainability\n\n## Implementation\n- **Development Guidance**: Ensure compatibility with COBOL and CICS, Maintain data integrity across batch processes, Avoid hardcoding configuration parameters\n- **Testing Approach**: Comprehensive testing of batch processes and transaction handling, including performance testing under load.\n- **Deployment Notes**: Deployment requires careful configuration of JCL scripts and IMS databases, with attention to resource allocation and job dependencies.\n\n## Modernization\n- **Current Technology**: COBOL, CICS, IMS, JCL, PL/I\n- **Modernization Options**: Consider migration to Java or .NET, Explore cloud-based database solutions\n- **Refactoring Opportunities**: Modularize monolithic COBOL programs, Enhance error handling and logging mechanisms"
}