{
  "sdd_section": {
    "metadata": {
      "section_number": "6",
      "section_title": "Process Design",
      "generated_date": "2025-11-20",
      "estimated_pages": 12,
      "word_count": 4500
    },
    "content": {
      "introduction": {
        "purpose": "This section documents the actual design of business processes and workflows within the Legacy Banking System.",
        "overview": "The section provides a detailed analysis of the existing business process designs, transaction flow designs, and the actual implementation of these processes in the legacy system.",
        "organization": "The section is organized into subsections detailing business process design and transaction flow design, with specific focus on real components and their functionalities."
      },
      "main_sections": [
        {
          "subsection_number": "6.1",
          "subsection_title": "Business Process Design",
          "content": "This subsection covers the design of business processes and operational workflows as implemented in the legacy system. It includes detailed descriptions of the components involved, their functionalities, and the business logic they implement.",
          "components": [
            {
              "name": "INQCUST.cbl",
              "type": "COBOL_PROGRAM",
              "description": "Retrieves comprehensive customer details based on a provided customer identification number.",
              "source_files": [
                "INQCUST.cbl"
              ],
              "key_features": [
                "Validates customer number input",
                "Generates random customer numbers for special cases",
                "Retrieves last active customer number",
                "Queries and retrieves customer data from storage"
              ],
              "interfaces": [
                "Input: Customer number",
                "Output: OUTPUT-DATA structure, INQCUST-INQ-SUCCESS, INQCUST-INQ-FAIL-CD"
              ]
            },
            {
              "name": "INQACCCU.cbl",
              "type": "COBOL_PROGRAM",
              "description": "Retrieves all associated account records for a given customer by querying a DB2 database.",
              "source_files": [
                "INQACCCU.cbl"
              ],
              "key_features": [
                "Validates customer number",
                "Uses DB2 cursor for account retrieval",
                "Fetches up to 20 account records per customer"
              ],
              "interfaces": [
                "Input: Customer number",
                "Output: RETURNED-DATA structure"
              ]
            }
          ],
          "technical_details": {
            "design_patterns": "The programs utilize procedural programming patterns typical of COBOL applications.",
            "algorithms": "Key algorithms include customer number validation and DB2 cursor management for data retrieval.",
            "data_structures": "Important data structures include OUTPUT-DATA and RETURNED-DATA, which store customer and account information respectively.",
            "error_handling": "Error handling is managed through status indicators and SQLCODE checks for database operations."
          },
          "requirements_trace": [
            {
              "requirement_id": "FR-001",
              "requirement_title": "Customer Account Creation",
              "satisfaction": "The design satisfies the requirement by ensuring customer details are retrieved and validated before account creation."
            }
          ]
        },
        {
          "subsection_number": "6.2",
          "subsection_title": "Transaction Flow Design",
          "content": "This subsection details the design of transaction processing flows, focusing on the actual implementation of transaction logic and validation rules.",
          "components": [
            {
              "name": "GETCOMPY.cbl",
              "type": "COBOL_PROGRAM",
              "description": "Sets a global company name variable for use within the CICS environment.",
              "source_files": [
                "GETCOMPY.cbl"
              ],
              "key_features": [
                "Sets company name to 'CICS Bank Sample Application'",
                "Returns control to the calling program"
              ],
              "interfaces": [
                "Output: COMPANY-NAME variable in DFHCOMMAREA"
              ]
            }
          ],
          "technical_details": {
            "design_patterns": "The program follows a simple utility pattern to provide consistent application identifiers.",
            "algorithms": "The primary algorithm involves setting a static company name and returning control.",
            "data_structures": "The DFHCOMMAREA is used to store and pass the company name.",
            "error_handling": "Minimal error handling is required due to the straightforward nature of the program."
          },
          "requirements_trace": [
            {
              "requirement_id": "NFR-001",
              "requirement_title": "System Performance",
              "satisfaction": "The design supports performance requirements by ensuring efficient execution of utility functions."
            }
          ]
        }
      ],
      "summary": {
        "key_decisions": [
          "Use of COBOL for business logic implementation",
          "DB2 for data retrieval and storage"
        ],
        "trade_offs": [
          "Limited modernization due to COBOL and CICS constraints",
          "Complexity in handling special customer number cases"
        ],
        "future_considerations": [
          "Potential migration to modern programming languages",
          "Enhancements in data retrieval efficiency"
        ]
      }
    },
    "implementation": {
      "development_guidance": [
        "Ensure COBOL code adheres to existing standards",
        "Maintain clear documentation of business logic",
        "Avoid hardcoding values where possible"
      ],
      "testing_approach": "Testing involves validating customer and account retrieval processes, ensuring correct handling of special cases and database interactions.",
      "deployment_notes": "Deployment requires careful configuration of CICS and DB2 environments to ensure compatibility with existing infrastructure."
    },
    "modernization": {
      "current_technology": "The system is built on a COBOL and CICS technology stack, with DB2 for database management.",
      "modernization_options": [
        "Consider migrating to Java or .NET for improved maintainability",
        "Explore cloud-based database solutions for scalability"
      ],
      "refactoring_opportunities": [
        "Simplify business logic by reducing special case handling",
        "Improve error handling mechanisms"
      ]
    }
  },
  "markdown_content": "# 6 Process Design\n\n## Introduction\nThis section documents the actual design of business processes and workflows within the Legacy Banking System. It provides a detailed analysis of the existing business process designs, transaction flow designs, and the actual implementation of these processes in the legacy system.\n\n## 6.1 Business Process Design\nThis subsection covers the design of business processes and operational workflows as implemented in the legacy system. It includes detailed descriptions of the components involved, their functionalities, and the business logic they implement.\n\n### INQCUST.cbl - Customer Inquiry Program\n- **Purpose**: Retrieves comprehensive customer details based on a provided customer identification number.\n- **Inputs**: Customer number\n- **Outputs**: OUTPUT-DATA structure, INQCUST-INQ-SUCCESS, INQCUST-INQ-FAIL-CD\n- **Business Logic**: Validates customer number input, generates random customer numbers for special cases, retrieves last active customer number, queries and retrieves customer data from storage.\n\n### INQACCCU.cbl - Account Inquiry Program\n- **Purpose**: Retrieves all associated account records for a given customer by querying a DB2 database.\n- **Inputs**: Customer number\n- **Outputs**: RETURNED-DATA structure\n- **Business Logic**: Validates customer number, uses DB2 cursor for account retrieval, fetches up to 20 account records per customer.\n\n## 6.2 Transaction Flow Design\nThis subsection details the design of transaction processing flows, focusing on the actual implementation of transaction logic and validation rules.\n\n### GETCOMPY.cbl - Company Name Utility Program\n- **Purpose**: Sets a global company name variable for use within the CICS environment.\n- **Outputs**: COMPANY-NAME variable in DFHCOMMAREA\n- **Business Logic**: Sets company name to 'CICS Bank Sample Application', returns control to the calling program.\n\n## Summary\n- **Key Decisions**: Use of COBOL for business logic implementation, DB2 for data retrieval and storage.\n- **Trade-offs**: Limited modernization due to COBOL and CICS constraints, complexity in handling special customer number cases.\n- **Future Considerations**: Potential migration to modern programming languages, enhancements in data retrieval efficiency.\n\n## Implementation\n- **Development Guidance**: Ensure COBOL code adheres to existing standards, maintain clear documentation of business logic, avoid hardcoding values where possible.\n- **Testing Approach**: Testing involves validating customer and account retrieval processes, ensuring correct handling of special cases and database interactions.\n- **Deployment Notes**: Deployment requires careful configuration of CICS and DB2 environments to ensure compatibility with existing infrastructure.\n\n## Modernization\n- **Current Technology**: The system is built on a COBOL and CICS technology stack, with DB2 for database management.\n- **Modernization Options**: Consider migrating to Java or .NET for improved maintainability, explore cloud-based database solutions for scalability.\n- **Refactoring Opportunities**: Simplify business logic by reducing special case handling, improve error handling mechanisms."
}